conference ,title,description,company,industry
NVIDIA GTC 2020,Accelerating Unsupervised SAR Polarimetric Image Segmentation by Parallel Wishart Classifier [P21999],"Our poster presents the unsupervised segmentation of SAR polarimetric images. These images are multi-band areal images of the Earth captured by satellites with special sensors. The process required to segment these images is massive, and the task of segmentation is crucial, as through it we needed to extract important physical information of the area under observation, such as the geometric orientation, structure, shape, and configuration. We propose a much faster parallel implementation of Wishart Classification Based technique that outperforms the vanilla methods by 240%.","Shivam Patel, Visiting Research Student, University of Cambridge",Aerospace / National labs
NVIDIA GTC 2020,AI @ The Network Edge (Presented by HPE) [S22480],"It's at the extreme edge of your network, where most data generation occurs. In this session, we'll cover the unique system, software, and data capabilities required to extend AI to the edge in extreme environments. We will also discuss how to extend the data fabric that AI depends on from the edge to other processing elements within the Core and Cloud.","Jeffrey Winterich, DoD Account Chief Technologist, Hewlett Packard Enterprise",Aerospace / National labs
NVIDIA GTC 2020,Anomaly Detection on Aircraft Sensor Data Using Deep Learning [s21454],"A vast amount of aircraft sensor data still remains unexploited due to its volume and shear complexity. In 2019, Airbus released, as part of a four-month long challenge, a 65+ gigabyte dataset recorded from real aircraft systems. The goal was to detect a set of anomalies from an unlabeled multidimension time series dataset. We'll describe our solution, which is based on a two-stage approach using auto encoders and long short-term memory neural networks, and how we reached third place out of 160 teams competing. You'll learn the benefits of using autoencoder to achieve dimension reduction in a clustering problem and how LSTM-based neural networks can be applied to detect anomalies in an unsupervised way. We'll dive into the technical details of the solution and discuss the results obtained, as well as potential next steps. Basic knowledge of deep learning-techniques such as Autoencoder or LSTM will help, but isn't required.","Stephane Rion, Deep Learning Scientist, Teradata",Aerospace / National labs
NVIDIA GTC 2020,Complex 60 GPU CFD Simulations for Aerospace Gearboxes [s21788],"We'll present a unique new computational fluid dynamics approach to solving the extremely complex multiphase case of an aerospace gearbox model using a purely GPU-based CFD solver, Altair nanoFluidX. The challenge is to better understand the complex flow inside such machinery, as good oil supply to all the key areas inside the gearbox is critical for efficient heat management, lubrication, and fuel consumption. We'll introduce the numerical method used, main challenges of the current state-of-the-art methods, CFD results (flow fields), and performance numbers from the cluster, going all the way up to 60 GPUs.","Milos Stanic, Product Manager, Altair Engineering",Aerospace / National labs
NVIDIA GTC 2020,Deep Learning-Based Anti-Drone System [P21900],This poster is about research on detecting and tracking drones by applying deep learning technology to capture drones that are illegally operated.,"Hanseob Lee, Ph.D. Candidate, KAIST",Aerospace / National labs
NVIDIA GTC 2020,Deep-Learning Model for Finding New Superconductors [P21328],"We report the first deep-learning model for finding new superconductors. We represented the periodic table in such a way that deep learning can learn it. Although we used only the chemical composition of materials as information, we obtained an R2 value of 0.92 for predicting Tc for materials in a database of superconductors. We obtained three remarkable results. The deep-learning method can predict superconductivity for a material with a precision of 62\%, which shows the usefulness of the model; it found the recently discovered superconductor CaBi2, which is not in the superconductor database; and it found Fe-based high-temperature superconductors (discovered in 2008) from the training data before 2008. These results open the way for the discovery of new high-temperature superconductor families.","Tomohiko Konno, Researcher, National Institute of Information and Communications Technology",Aerospace / National labs
NVIDIA GTC 2020,Landing on Mars: Petascale Unstructured-Grid Computational Fluid Dynamics Simulations on Summit [S21584],"We'll present a campaign to investigate the use of supersonic retropropulsion as a means to land payloads large enough to enable human exploration on Mars. The world’s largest supercomputer, Summit, located at Oak Ridge National Laboratory, performs simulations. We'll review the engineering and computational challenges associated with retropropulsion aerodynamics and the need for large-scale resources like Summit. A GPU implementation of NASA Langley Research Center's FUN3D flow solver is used for these simulations. We'll compare the development history, performance, and scalability with those of contemporary HPC architectures. Using an optimized GPU-accelerated computational fluid dynamics solver on Summit has enabled simulations well beyond conventional computing paradigms.","Eric Nielsen, Senior Research Scientist, Nasa Langley Research Center",Aerospace / National labs
NVIDIA GTC 2020,Large-Scale Landslides Detection from Satellite Images with Incomplete Labels [P21920],"Earthquakes and tropical cyclones cause suffering for millions of people around the world every year. The resulting landslides exacerbate the effects of these disasters. Landslide detection is, therefore, critical for protecting human life and livelihood in mountainous areas. To tackle this problem, we propose a combination of satellite technology and deep neural networks (DNNs). We evaluate the performance of multiple DNN-based methods for landslide detection on actual satellite images of landslide damage using the capabilities of high-performance GPUs. Our analysis demonstrates the potential for a meaningful social impact on disasters and rescue.","Masanari Kimura, Engineer, Ridge-i inc.",Aerospace / National labs
NVIDIA GTC 2020,LUCID: High-Resolution Ground-Based Observations of LEO Satellites with Multi-Frame Blind Deconvolution [s21270],"High-resolution imaging of objects in space from a ground-based observatory is achievable with a sufficiently large aperture, but atmospheric turbulence causes significant degradation. Computationally expensive algorithms can mitigate the blurring effects of turbulence, and these algorithms have only recently begun to leave the domain of CPU-bound computation. We'll describe space domain awareness, the imaging-through-turbulence problem, and algorithms that attempt to solve it. We'll also describe Likelihood-based Uncertainty Constrained Iterative Deconvolution (LUCID), a new multi-frame blind deconvolution implementation that uses CUDA to extract high-resolution images of low-Earth-orbit (LEO) satellites from a series of short-exposure observations.","Michael Werth, Physicist, The Boeing Company",Aerospace / National labs
NVIDIA GTC 2020,Super-Resolution of Digital Terrain Data [P21822],"Given a digital elevation model (DEM) at some fixed-grid post spacing, we'd like to better interpolate between the posts to produce a DEM of higher resolution. Intuitively, single-image super-resolution techniques can do that. A neural network is trained on low-resolution elevation data (for example, 90m post spacing) until it can produce a reasonable approximation of higher-resolution elevation data, such as 30m post spacing. Dictionary-based interpolation is achieved through a statistical mapping from low-resolution (LR) features to high-resolution (HR) features, as learned by the hidden layers in the network. This approach shows promising results in producing pseudo-HR elevation models from LR models, and if applied to HR data, can produce pseudo-VHR models suitable for meshing with lidar scans.","Theodore Hromadka, Senior Principal Software Engineer, Centauri",Aerospace / National labs
NVIDIA GTC 2020,Using Robust Networks to Inform Lightweight Models in Semi-Supervised Learning for Object Detection [P21789],"Learn from industry practitioners as we present a practical, streamlined data curation workflow designed to mitigate burdens associated with hand-labeled data for supervised learning in object detection. We utilize the capacity of robust object detection networks to efficiently train low-latency networks with access to large pools of unlabeled data but only limited hand-labeled data. By fine-tuning a robust model on the limited examples, we create new, larger training datasets via robust inference on unlabeled data. The combined hand-labeled subset and the inferenced dataset are then used to train a lightweight model. This approach results in more accurate lightweight models with minimal cost from hand-labeled data while also providing an efficient way of curating ground-truth datasets.","Jonathan Worobey, Software Engineer, SURVICE Engineering",Aerospace / National labs
NVIDIA GTC 2020,VR Blast Forensics [S21629],We'll present a unique approach of coupling high-fidelity computational physics GPU-based solvers with the software Unity to produce a post-blast forensics virtual reality environment. We'll also cover the benefits of utilizing GPUs to perform both computational physics and VR rendering.,"Phillip Mulligan, Assistant Research Professor, Missouri University of Science and Technology",Aerospace / National labs
NVIDIA GTC 2020,WASP: A WeArable SuPercomputing Platform for Lost Person Search-and-Rescue [P22071],"WASP, A WeArable SuPercomputing Platform for Lost Person Search-and-Rescue (SAR), redefines computation at the edge. More than 100,000 people were reported lost in the wilderness and urban settings in the United States in 2017. Use of UAVs for SAR applications shines due to their aerial point of view, enhanced mobility, and wireless connectivity by virtue of unhindered airspace in otherwise-dense foliage. Despite these benefits, the adoption of UAVs in such applications is rendered somewhat infeasible due to their short flight times and limited computation and load-bearing capabilities. WASP, which houses four Jetson Xavier AGXs, aims at offloading computation from the drone to a wearable backpack for the human-in-the-loop searcher, with a high-capacity battery and wireless router. The backpack not only manages massive real-time computational workloads including deep-learning inference, dynamic path planning, and GUI, but also hands-off enhanced control and contextual information to the human searchers.","Chinmaya Patnayak, Student, Virginia Tech",Aerospace / National labs
NVIDIA GTC 2020,Accelerating DNN Inference with GraphBLAS and the GPU [S21796],"Our work addresses the 2019 Sparse Deep Neural Network Graph Challenge with an implementation using the GraphBLAS programming model. We'll demonstrate our solution to this challenge with GraphBLAST, a GraphBLAS implementation on the GPU, and compare it to SuiteSparse, a GraphBLAS implementation on the CPU. The GraphBLAST implementation is 1.94x faster than SuiteSparse; the primary opportunity to increase performance on the GPU is a higher-performance sparse-matrix-times-sparse-matrix (SpGEMM) kernel.","Xiaoyun Wang, Ph.D. Candidate, University of California, Davis",Aerospace / National labs
NVIDIA GTC 2020,Accelerating Graph Algorithms on Exascale Systems [S21642],"We'll discuss our current efforts for accelerating graph algorithms on the latest US Department of Energy leadership systems. Graph methods are key kernels for large-scale data analytics, as well as for several exascale application domains, including smart grids, computational biology, computational chemistry, and climate science. We'll present our latest results on distributed implementations employing GPUs and accelerators of graph kernels such as community detection and influence maximization, showing how we can tackle large-scale problems with heterogeneous supercomputers.","Mahantesh Halappanavar, Senior Research Scientist and Team Lead, Pacific Northwest National Laboratory",Aerospace / National labs
NVIDIA GTC 2020,Accelerating Large-Scale GW Calculations in Material Science [s21353],"Learn the balancing act of porting a large-scale HPC code to modern GPUs, where a plethora of architectural characteristics can both accelerate and limit performance. We'll showcase various techniques used to accelerate the material science code BerkeleyGW on NVIDIA GPUs targeting large-scale simulations with thousands of atoms, matrices of up to 1 million by 1 million, and reductions of thousands of billions of numbers. These techniques include the use of cuBLAS and cuFFT, pinned memory, streams, batched operations, shared memory, and the overlapping of message-passing interface communication and GPU computation. Excellent strong scaling and weak scaling are observed on thousands of Volta GPUs, and a 16x improvement is obtained on FLOPs/Watt efficiency compared to the CPU-only implementation.","Charlene Yang, Application Performance Specialist, NERSC, Lawrence Berkeley National Laboratory",Aerospace / National labs
NVIDIA GTC 2020,Accelerating the Singular Value Decomposition: Measuring SVD Performance for Small Matrices [P21776],"Advanced algorithms for spatio-temporal signal processing of data from a phased sensor array often require singular value decompositions (SVD) of a very large number of complex-valued matrices of a relatively small size. Our poster describes a GPU-implemented SVD that we custom-designed for such signal processing applications in order to enable real-time performance. We compare our SVD with tools available in the cuSolver, MKL, and MAGMA libraries, and we document a substantial performance improvement on batches of small square matrices.","Charlotte Kotas, Research Scientist, Oak Ridge National Laboratory",Aerospace / National labs
NVIDIA GTC 2020,A Framework for Measuring Hardware Gather-Scatter Support [P21887],"This poster describes a new benchmark tool, Spatter, for assessing memory system architectures in the context of indexed accesses. This type of memory operation is often used to express sparse and irregular data patterns. Gathers and scatters have widespread utility in modern HPC applications, including traditional scientific simulations, data mining and analysis computations, and graph processing. Spatter specifically measures gather / scatter (G/S) variations for multiple platforms, with several tunable backends, including CUDA and OpenMP, and provides comparison metrics for different sparse access patterns. We show how Spatter can be used to evaluate the recent improvements to G/S hardware on NVIDIA GPUs and CPUs, and show performance numbers for STREAM-like, uniform-stride, and application-derived memory access patterns.","Patrick Lavin, Ph.D. Student, Georgia Tech",Aerospace / National labs
NVIDIA GTC 2020,A Partitioned Global Address Space Library for Large GPU Clusters [S22093],"We'll discuss NVSHMEM, a PGAS library that implements the OpenSHMEM specification for communication across NVIDIA GPUs connected by different types of interconnects that include PCI-E, NVLink, and Infiniband. NVSHMEM makes it possible to initiate communication from within a CUDA kernel. As a result, CUDA kernel boundaries are not forced on an application due to its communication requirements. Less synchronization on the CPU helps strong scaling efficiency. Ability to initiate fine-grained communication from inside the CUDA kernel helps achieve better overlap of communication with computation. QUDA is a popular GPU-Enabled QCD library used by several popular packages like Chroma and MILC. NVSHMEM enables better strong scaling in QUDA. NVSHMEM not only benefits latency-bound applications like QUDA, but can also help improve performance and reduce complexity of codes like FFT that are bandwidth-bound, and codes like Breadth First Search that have a dynamic communication pattern.","Akhil Langer, Senior Software Engineer, NVIDIA",Aerospace / National labs
NVIDIA GTC 2020,A Performance-Portable Diffusion Solver Based on Axom [P21892],"The sheer size and complexity of large-scale multiphysics codes motivate maintenance of a single-source codebase that is parallel and readily portable across different architectures. This is especially attractive due to recent trends toward heterogeneous architectures. We present Mint, an API that provides a mesh-aware, fine-grain, parallel execution model that underpins the development of computational tools and discretization methods. We build a 2D finite-volume diffusion solver that models separation of chemical species that arise in inertial confinement fusion. We demonstrate portability of the solver across two different architectures, one on a CPU-based architecture and one with CPU+GPU architecture. When compiled with the CUDA backend relative to the OpenMP backend, we find up to 3.5x speedup, demonstrating the viability of the API.","Tyler Masthay, Research Assistant, University of Texas at Austin",Aerospace / National labs
NVIDIA GTC 2020,Applications of Convolutional Neural Network to the Important Earth Science Problems [P22283],"We applied the convolutional neural network to several Earth science problems that involve (1) discrimination of seismic signals from earthquakes and tectonic tremors; (2) determination of an earthquake hypocenter; and (3) solar radiation estimation from fixed-point camera images. Monitoring tremor activity provides insights into deformation processes of megathrust earthquakes. We could achieve 99.5% accuracy for identifications of signals from tremors, regular earthquakes, and noise. We establish neural networks for the determination of hypocentral parameters. We calculate theoretical seismograms for a realistic 3D Earth model and use these seismograms as learning dataset. We can determine an earthquake hypocenter with this neural network. We develop a new observation method that used deep learning to estimate the amount of solar radiation from images. This new technique can be used to make multifaceted observations.","Daisuke Sugiyama, Engineer, Japan Agency for Marine-Earth Science and Technology",Aerospace / National labs
NVIDIA GTC 2020,Big Lasers for Small Accelerators: Exascale Simulations for Better Cancer Therapy [S21850],"Learn how we leverage PIConGPU, an open source, multi-platform particle-in-cell code scaling to the fastest supercomputers in the TOP500 list (Titan, Piz Daint, Summit), to model advanced plasma physics applications. Advances in compact plasma-based accelerators driven by petawatt-class lasers spark great interest in their applications. Ion beams accelerated by intense laser pulses break new ground for treating cancer. Laser-generated electron beams can drive new compact X-ray sources to create snapshots of ultrafast processes in materials and show a path to reaching the energy frontier for studying fundamental physics. We'll present our strategies to harness the power of future exascale supercomputers, handling extreme data flows from thousands of GPUs for analysis with in-situ data analytics and an open data ecosystem. We'll provide detailed performance analysis and show the benefits of PIConGPU for real-world physics cases.","Michael Bussmann, Head of Center for Advanced Systems Understanding, Helmholtz-Zentrum Dresden-Rossendorf",Aerospace / National labs
NVIDIA GTC 2020,CUDA C++ in Jupyter: Adding CUDA Runtime Support to Cling [S21588],"Jupyter Notebooks are omnipresent in the modern scientist's and engineer's toolbox just as CUDA C++ is in accelerated computing. We present the first implementation of a CUDA C++ enabled read-eval-print-loop (REPL) that allows to interactively ""script"" the popular CUDA C++ runtime syntax in Notebooks. With our novel implementation, based on CERN's C++ interpreter Cling, the modern CUDA C++ developer can work as interactively and productively as (I)Python developers while keeping all the benefits of the vast C++ computing and library ecosystem coupled with first-class performance.","Axel Huebl, Researcher, Lawrence Berkeley National Laboratory",Aerospace / National labs
NVIDIA GTC 2020,Day of the Living Cell: Supercomputers Reveal Molecular Design Principles of Photosynthesis [S21500],"We'll discuss developing the highly parallel molecular dynamics code NAMD for current and upcoming machines, followed by an accessible presentation of results from a decade of work that paves the way to first-principles modeling of whole living cells. One of the many ambitious research projects begun by the late Klaus Schulten was to model, simulate, and ultimately understand the photosynthetic apparatus of bacteria, from the scale of individual atoms to that of the entire cell. The GPU-accelerated supercomputers of Oak Ridge National Laboratory running NAMD have been critical to enabling progress in this continuing work.","James Phillips, Senior Research Programmer, University of Illinois",Aerospace / National labs
NVIDIA GTC 2020,Deep Learning for Efficient Modeling of High-Dimensional Spatiotemporal Physics [S22094],"Several research problems in physical sciences are exceptionally complex and high-dimensional, exhibiting spatio-temporal dynamics, non-linearity, and chaos. In an era when vast quantities of such scientific data are generated, building practical, physics-driven reduced-order models (ROM) of such phenomena is crucial. While deep neural networks for spatio-temporal data have shown considerable promise, they face severe computational bottlenecks in learning extremely high-dimensional datasets, often with greater than 10^9 degrees of freedom. These application-agnostic networks may also lack physical constraints and interpretability that is desired in scientific ROMs. We'll present our efforts in leveraging the strong mathematical and physical foundations underlying wavelet theory with the learning capacity of deep neural nets. We'll demonstrate computationally efficient, partially interpretable learning with some embedded physics constraints for modeling large scientific datasets.","Arvind Mohan, Postdoctoral Researcher, Los Alamos National Laboratory",Aerospace / National labs
NVIDIA GTC 2020,Dramatic Acceleration of Quantum Transport Simulations: Solving Non-Equilibrium Green’s Function with GPU Devices [P21787],"The poster presents in-depth discussion on technical details and strategies for GPU-driven performance enhancement in solving the Non-Equilibrium Green's Function (NEGF), which is critically used to simulate quantum transport behaviors of electronic devices in a nanoscale regime. Although here we focus on NEGF as a main target of performance enhancement, the contents (particularly the strategies of performance improvement with GPU computing) presented in this poster can be still useful for ANY numerical problems that involve the computation of an inverse of block-tridiagonal (dense/sparse, real/complex) matrices.","Yosang Jeong, Researcher, Korea Institute of Science and Technology Information",Aerospace / National labs
NVIDIA GTC 2020,Effective Use of Mixed Precision for HPC [S21725],"We'll discuss how using mixed-precision techniques effectively can significantly speed up current-generation supercomputers, as well as the practical and numerical challenges in adopting such techniques. We'll focus specifically on lattice quantum chromodynamics, which is a regular top-cycle consumer of public supercomputers. Such techniques are an important and sometimes necessary optimization direction for HPC applications.","Kate Clark, Principal Developer Technology Engineer, NVIDIA",Aerospace / National labs
NVIDIA GTC 2020,Enabling 800 Projects for GPU-Accelerated Science on Perlmutter at NERSC [S21582],"The National Energy Research Scientific Computing Center (NERSC) is the mission HPC center for the U.S. Department of Energy Office of Science and supports the needs of 800+ projects and 7,000+ scientists with advanced HPC and data capabilities. NERSC’s newest system, Perlmutter, is an upcoming Cray system with heterogeneous nodes including AMD CPUs and NVIDIA Volta-Next GPUs. It will be the first NERSC flagship system with GPUs. Preparing our diverse user base for the new system is a critical part of making the system successful in enabling science at scale. The NERSC Exascale Science Application Program is responsible for preparing the simulation, data, and machine learning workloads to take advantage of the new architecture. We'll outline our strategy to enable our users to take advantage of the new architecture in a performance-portable way and discuss early outcomes. We'll highlight our use of tools and performance models to evaluate application readiness for Perlmutter and how we effectively frame the conversation about GPU optimization with our wide user base. In addition, we'll highlight a number of activities we are undertaking in order to make Perlmutter a more productive system when it arrives through compiler, library, and tool development. We'll also cover outcomes from a series of case studies that demonstrate our strategy to enable users to take advantage of the new architecture. We'll discuss the programming model used to port codes to GPUs, the strategy used to optimize code bottlenecks, and the GPU vs. CPU speedup achieved so far. The codes will include Tomopy (tomographic reconstruction), Exabiome (genomics de novo assembly), and AMReX (Adaptive Mesh Refinement software framework).","Jack Deslippe, Application Performance Group Lead, NERSC",Aerospace / National labs
