conference ,title,description,company,industry
NVIDIA GTC 2020,Clara Developer Day: Federated Learning using Clara Train SDK [S22564],"Federated Learning techniques enable training robust AI models in a de-centralized manner – meaning that the models can learn from diverse data but that data doesn't leave the local site and always stays secure. This is achieved by sharing model-weights or partial model weights from each local client and aggregating these on a server that never accesses the source data. In this session we will deep dive into the federated learning architecture of latest Clara Train SDK. We will cover the core concepts of Federated Learning and the different collaborative learning techniques. Afterward, we will dive deeper into how using the Clara Train SDK enables privacy-preserving Federated Learning. This session will also cover the ease of bringing up Federated Learning clients and establishing communication between various clients and a server for model aggregation.","Nicola Rieke, Senior Deep Learning Solution Architect - Healthcare, NVIDIA",Healthcare & Life Sciences
NVIDIA GTC 2020,Clara Developer Day: Getting Started with Clara Train for High Performance & Iterative Experimentation with AutoML [S22563],"In this session, developers and data scientists will learn how using Clara Train SDK accelerates and standardizes model development for medical imaging. We will cover the SDKs core concepts and capabilities to define a training workflow with the option to “bring your own components”. The session will also include a hands-on deep dive on how optimize hyper-parameter using AutoML.","Ahmed Harouni, Solutions Architect, NVIDIA",Healthcare & Life Sciences
NVIDIA GTC 2020,Clara Developer Day: Scalable and Modular Deployment Powered by Clara Deploy SDK [S22565],"Clara Deploy SDK provides a reference framework for developers, data scientists and engineers to make seamless the process to turn trained AI models into operators. These operators can be stitched together to define an AI deployment pipeline, using reference DICOM adapters and sample pipelines that can interface with a medical imaging environment, like a PACS or VNA. In this session, we will do a walk-through of platform features that enable scalable deployment of multiple AI based pipelines in a hospital IT-like infrastructure. We will also do a hands-on session enabling end-end deployment of a Clara Train model. The users will interact with the SDK to deploy reference pipelines and learn how they can use the modular nature of the overall framework to power deployment of AI models in medical imaging workflows.","Jesse Tetreault, Solutions Architect, NVIDIA",Healthcare & Life Sciences
NVIDIA GTC 2020,Computer Vision in Agriculture: Racing with Pests and Diseases [P22001],"Modern technologies of GPU computing and machine learning allow us to create an autonomous system of greenhouse plant condition control. We combined multiple sensor systems with a photo/video surveillance system, which allows us to create a comprehensive control system helpful for early detection of pests and diseases. We strive to create a stable and reliable solution for AI-based early plant disease detection, disease classification, pest detection, and plant development monitoring. We present our working solutions for vertical farming and a prototype of a more general system.","Ivan Molodtsov, Head of Machine Learning, Fermata",Healthcare & Life Sciences
NVIDIA GTC 2020,Data-Driven Approach of Coronary Vessel Reconstruction Using X-ray Angiography [P21799],"Coronary artery disease is typically diagnosed using X-ray angiography. The percent stenosis, or narrowing of the blood vessel, is estimated via visual inspection of 2D angiography images; however, image artifacts and non-ideal projection angles can lead to miscalculation of disease severity. To address this problem, we propose a data-driven method to reconstruct the 3D geometry of the coronary vessels. A convolutional neural network was trained to segment vessels from angiography images. The segmented binary images were subsequently used as input images for several 3D reconstruction algorithms. The reconstructed 3D geometry can be used as input data for computational fluid dynamics analysis to characterize the hemodynamics of the diseased vessel and thus further improve diagnostic accuracy.","Kritika Iyer, Ph.D. Candidate, University of Michigan",Healthcare & Life Sciences
NVIDIA GTC 2020,Data-Efficient Weakly Supervised Histology Classification Using Contrastive Predictive Coding [P22025],"Neural network classification models can be trained on weakly annotated medical imaging data using multiple instance learning (MIL). However, due to weak supervisory signals, direct application of MIL suffers from overfitting when faced with limited labeled data and the network is unable to learn rich feature representations. To overcome such limitations, we propose a two-stage semi-supervised approach that combines data-efficient self-supervised feature learning via contrastive predictive coding (CPC) and attention-based MIL. Across five random splits, we report state-of-the-art performance with a mean validation accuracy of 95% and an area under the ROC curve of 0.968 on a breast cancer classification dataset. We evaluate the quality of features learned via CPC relative to simple transfer learning and show that strong classification performance using CPC features can be efficiently leveraged under the MIL framework using limited labels and with the feature encoder frozen.","Ming Yang Lu, Research Intern , Computational Pathology, Brigham and Women's Hospital, Harvard Medical School",Healthcare & Life Sciences
NVIDIA GTC 2020,"Deep Learning-Aided Label-Free, Real-Time and Time-Lapse “Cell Visualization” Technology that Enables Live/Dead Cell Discrimination and Counting [P21952]","""Cell visualization"" is a new technology that can predict cell properties, such as cell life and death, from bright-field cell images. It's necessary to build a deep-learning model in which the relationship between a teacher cell image, such as fluorescence labeling indicating cell properties, and the corresponding bright-field cell image is finely learned. Inputting unknown bright-field cell images to the constructed learning model generates a pseudo-fluorescent labeling image showing the characteristics of the cells, enabling ""visualization of cells."" The present technology may replace many cell assays in drug discovery by solving the invasiveness of fluorescence-based cell assays. This technology also realizes real-time monitoring of cell quality. This innovative cell digitization technology is expected to become essential in the fields of drug discovery and regenerative medicine.","Tamio Mizukami, Professor, Nagahama Institute of Bio-Science and Technology",Healthcare & Life Sciences
NVIDIA GTC 2020,Deep Learning in Health Care: from Voicebots to Disease Prediction [S21128],"We will focus on a few use cases where deep learning and NVIDIA GPUs help transform health care operations, automate prior authorization processes to reduce operational costs, suggest the next-best action to patients in order to help them manage their chronic conditions, and control call center volumes while increasing customer NPS scores. United Health Group receives over 30 million provider calls each year, out of which over 7 million result in call transfers. We've used a combination of deep learning models to identify the predictors of future calls and the providers likely to make them, enabling us to proactively reach out to them to prevent the incoming calls. If an incoming call is, however, detected, we use NVIDIA’s Nemo ASR / NLP framework to analyze the purpose of the call in real time and optimally route it to the appropriate agent. We'll also discuss our early successes in applying NVIDIA’s OpenSeq2Seq and Nemo frameworks to create voicebots — systems that users can interact with using voice. The quality of audio (smartphone versus phone line), domain (general versus clinical), speaker accents, and so on matter. We'll include an end-to-end overview of the tooling that we created for incremental data collection and model fine tuning on that data, along with metrics of quality and performance benchmarks. Finally, we'll cover our deep learning work on Next Best Action, where we use patients' history to predict the poly-chronic medical conditions and identify high-risk individuals. We then recommend the preventative next-best action, such as an ER visit or a hospitalization.","Julie Zhu, Distinguished Engineer/Chief Data Scientist, United Health Group, Optum Technology",Healthcare & Life Sciences
NVIDIA GTC 2020,"Deep, Self-Supervised Learning for Patient-Specific Anomaly Detection in Stereoelectroencephalography [S21962]","We'll discuss methods for accurate, real-time detection of anomalous events in medical time-series data, with particular application to stereoelectroencephalographic (SEEG) interpretation and event localization for patients with epilepsy. Previous deep learning-based approaches to detecting EEG anomalies have been plagued by high false-positive rates and inability to detect anomalous events that fall below a statically-set threshold. You'll learn the benefits of a nonparametric approach that utilizes a dynamic thresholding method for event detection, producing significant performance improvements. We'll discuss basic approaches and challenges in anomaly detection in medical time series data, limitations encountered by previous deep-learning approaches to anomaly detection, and how to apply a nonparametric dynamic thresholding procedure to improve performance and mitigate false positive results.","Anthony Costa, Director, Sinai BioDesign, Icahn School of Medicine at Mount Sinai",Healthcare & Life Sciences
NVIDIA GTC 2020,De Novo Protein Design of Epitope-Directed Inhibitors [s21348],"Protein drugs have revolutionized modern cancer therapeutics, as protein-based binders can effectively target molecules that are otherwise undruggable by small molecules. Presently, such binders are based on monoclonal antibodies, which are developed and engineered through lengthy and resource-intensive processes of iterative optimization that are empirically guided. Conversely, de novo protein design can offer a rational means for generating new binders with bespoke scaffolds, guided by physics-based computations. Here, we'll present our work on developing a purpose-built, GPU-accelerated computational pipeline for designing protein-based binders de novo. As a proof of principle, we designed proteins that target a key modulator of cancer metastasis. Our experimental characterization of only a few design candidates resulted in binders with strong binding affinities. Solving the structure of one design showed atomic-level agreement between the design model and the determined structure.","Mohammad ElGamacy, Postdoctoral Research Fellow, Friedrich Miescher Laboratory of the Max Planck Society",Healthcare & Life Sciences
NVIDIA GTC 2020,"Deploying FDA-Cleared, TRT-Powered AI Radiology Products to Improve Quality and Productivity in Clinical Radiology [S22400]","SubtlePET and SubtleMR are FDA-cleared AI software products developed by Subtle Medical that use deep learning to significantly improve the image quality and efficiency for PET-CT and MRI exams. We'll introduce how Subtle develops AI that is generalizable and seamlessly deployed in clinical settings. Join our session to:
Learn how to clinically evaluate and deploy AI software solutions at multiple hospitals and imaging centers, through Subtle’s experience of working with Stanford University, the University of California at San Francisco, Hoag hospital, U-C San Diego, Middlesex, RadNet, and others;
Understand how attention models and improved deep-learning architectures improve model performance;
Learn benefits of training algorithms on NVIDIA DGX Station and DGX-1 systems, and how it provides flexibility and efficiency from prototyping to product;
Learn how integrating with NVIDIA TensorRT can accelerate inference; SubtleMR will share there experience where turnaround time is critical, TRT provided additional speed of up to about 8.8x; and
Learn techniques to show how to show evidence of significant clinical values and financial ROI to customer hospitals and imaging centers.","Enhao Gong, Founder and CEO, Subtle Medical",Healthcare & Life Sciences
NVIDIA GTC 2020,Distributed Deep Learning for Automatic Disease Detection Systems [P22078],"Deep neural networks and other deep-learning approaches are providing diagnostic capabilities on a par with medical specialists. If deployed in the field, these DL applications and devices can help to detect health conditions early and develop preventive approaches. However, deploying such systems requires large compute infrastructure. To address the infrastructure issues, I developed a distributed cost-effective approach using edge devices and a cloud-based central hub for better predictions. To test its effectiveness, I applied it to diagnosing eye conditions using fundus images.","Ananya Gangavarapu, Student, Princeton International School of Mathematics and Science",Healthcare & Life Sciences
NVIDIA GTC 2020,Empowering Virtual Reality and Machine Learning in the Hospital [S21472],"A patient's journey through the hospital system involves long-established steps that, collectively, aim to define and provide the best treatment strategy. Two critical actors in this journey are the radiologist and the surgeon. They communicate via the patient's medical image. We'll discuss how we bring new GPU-based technologies, such as virtual reality and machine learning, to this very traditional place of work. We'll outline the degree to which these technologies have been useful in our medical collaborations, as well as how they can optimize outcomes for the patient.","Mohamed El Beheiry, Lead Developer, Institut Pasteur",Healthcare & Life Sciences
NVIDIA GTC 2020,Federated Learning for Medical Imaging: Collaborative AI without Sharing Patient Data [S21536],"While deep neural networks have shown promising results in various medical applications, they highly depend on the amount and diversity of the training data. In the context of medical imaging, this poses a major challenge because patient data needs to be protected and cannot easily be shared. The training data that is required to train a reliable and robust algorithm may not be available in a single institution due to the low incidence rate of some pathologies and limited numbers of patients. At the same time, it is often not feasible to collect and share patient data in a centralized data lake due to patient privacy concerns and regulations. Federated learning — as a collaborative machine learning paradigm — combined with an advanced privacy-preserving mechanism has the potential of solving this issue: models can be trained across several institutions without explicitly sharing patient data. When implementing and deploying a federated learning system into the real-world medical imaging ecosystem, participants can authenticate and communicate securely, and exchange model weights efficiently, enabling model training to be successful. In this talk, we present an introduction to the core concepts of federated learning and discuss the benefits as well as the unique considerations and challenges of implementing a federated-learning system in the context of health care.","Nicola Rieke, Senior Deep Learning Solution Architect - Healthcare, NVIDIA",Healthcare & Life Sciences
NVIDIA GTC 2020,Fostering a Strong Ecosystem for AI in Medical Imaging [S22631],"In order to fully leverage the possibilities that AI offers to drive higher-value health care, we need to create an effective collaboration between physicians and developers, policymakers and payers, and most importantly the patients we will serve. We'll explore ways in which those collaborations are already happening and highlight gaps and opportunities. The speaker, a practicing radiologist specializing in breast imaging, will discuss the ways in which she sees AI impacting her practice now and in the future.","Geraldine McGinty, Chief Strategy and Contracting Officer, Weill Cornell Medicine",Healthcare & Life Sciences
NVIDIA GTC 2020,Fully Automated Blood Analyzer Driving Early Detection for Leukemia Based on Cytomorphology [P22070],"The chances of leukemia survival depend on a variety of factors, including early detection and response to treatment. Cytomorphology introduces the methodology to characterize blood cell morphology to detect leukemia in the early stage. We developed a fully automated blood analyzer based on cytomorphology to count all types of different white blood cells, red blood cells, and blood platelets. The whole workflow of this system includes sample delivery, screening, segmentation, and classification. Compared with the other leading manufacturer, such as CellVision, the segmentation and classification in our system is driven by deep learning instead of pattern recognition, which lets our results achieve more than 95% accuracy based on the validation of a real dataset counted by doctors from a top hospital. It means that our system can be the first real-world health-care AI product in hematology. We'll introduce more detail about our workflow and AI technology accelerated by NVIDIA advanced GPU.","Jie Wang, AI Computing Specialist, Shanghai Jiao Tong University",Healthcare & Life Sciences
NVIDIA GTC 2020,Generating Microscopic Phase Images with Deep Learning [P22394],"This poster will present a deep-learning approach for generating microscopic phase images from brightfield images, contrasting it with current approaches. We'll highlight examples of novel techniques developed at PerkinElmer using supervised and self-supervised approaches to tackle common problems faced by classical approaches. We'll also discuss the challenges of building and testing these generative models for medical imaging and drug discovery applications.","Abdul Al-Haimi, Software Research Lead, PerkinElmer",Healthcare & Life Sciences
NVIDIA GTC 2020,GPU-Accelerated Animated Volume Rendering of Isogeometric Analysis Results [P22069],"Development of isogeometric analysis (IGA) has enabled tighter integration of engineering design and computational analysis. The core idea of IGA is to use same NURBS (Non-uniform rational B-splines) basis functions for representation of geometry in CAD and the approximation of solution fields in FEA. However, visualizing the results of volumetric IGA is compute-intensive; hence, current methods are not interactive. We developed a modified ray-casting and voxelization method for visualizing volumetric NURBS, which provides better interactive performance. This process has been highly parallelized using the GPU to produce interactive animated results in real time. We present an example of the utility of the approach in visualizing results of cardiac simulations.","Harshil Shah, Graduate Student, Iowa State University",Healthcare & Life Sciences
NVIDIA GTC 2020,GPU-Accelerated Genome Assembly: A Deep Dive into Clara Genomics Analysis SDK [S21968],"We'll present de novo genome assembly for long DNA reads using the Clara Genomics Analysis SDK and dig deep into the SDK implementation. We'll discuss the suitability of GPUs for genomics workloads and present algorithms suitable for massively parallel systems. We'll also review the challenges we faced while implementing the algorithms in CUDA, and present the solutions used in cudaAligner, cudaPoa, and cudamapper.","Andreas Hehn, Developer Technology Engineer, NVIDIA",Healthcare & Life Sciences
NVIDIA GTC 2020,"High Throughput Cryo-Electron Microscopy and Cryo-Electron Tomography Powered by GPU at the University of California, San Francisco [S21696]","As early as in 2009, GPU-based computing was introduced at the University of California, San Francisco (UCSF) to reconstruct electron tomographic volumes. Today, 10 years later, high-resolution cryo-electron microscopy (CryoEM) and cryo-electron tomography (CryoET) powered by state-of-the-art GPU technology are routinely used worldwide in structural biology. We'll present the development of GPU-based applications at UCSF to solve critical challenges in CryoEM and CryoET — namely, beam-induced motion, cryoET alignment, and deep-learning based de-noising of cryoEM low-dose images. You should be familiar with back- and forward-projections, Fourier Transforms, C++, and CUDA programming.","Shawn Zheng, Bioinformatics Specialist, Howard Hughes Medical Institute, University of California San Francisco",Healthcare & Life Sciences
NVIDIA GTC 2020,Holistic AI-Enhanced Workflows in Radiology [S21440],"We'll highlight the advantages of a holistic workflow in radiology, the opportunities and challenges of AI implementation in diagnostic workflows, and their impact on treatment decisions and patient outcomes. AI will have a tremendous impact on the way we think and work in medicine. Diseases are complex pathological processes and more than one algorithm is often needed to answer relevant medical questions. This requires a well-managed orchestration of the reporting workflow. We'll introduce the Smart Reporting platform as an innovative tool for synoptic AI-enhanced reporting, which massively improves interdisciplinary communication. Leveraging on NVIDIA Clara and GPU computing, we'll also present a novel pipeline for prostate cancer imaging, tumor detection, automatic report generation, communication of results, and improved treatment decisions.","Alvaro Sanchez, Principal Software Engineer, Smart Reporting GmbH",Healthcare & Life Sciences
NVIDIA GTC 2020,Improving Classification of Lymph Node Histopathology Patches Using Semi-Supervised Classification-GAN (SSC-GAN) [P21984],"The goal of our Semi-Supervised Classification-GAN (SSC-GAN) on histopathology images is to use generated synthetic images to aid in data augmentation and improving classification accuracy, beyond the regular classifiers such as CNNs, where access to annotated data is limited.","Aditya Mitkari, Machine Learning scientist, Onward Health",Healthcare & Life Sciences
NVIDIA GTC 2020,Improving CNN Performance with Spatial Context [S21388],"Deep learning with convolutional neural networks (CNN) is a powerful technique with wide-ranging applications. It has largely replaced traditional computer vision as the go-to method for solving image-analysis and classification problems. At its essence, however, training a CNN is an enormous global optimization problem which, like all optimizations, can fall victim to local extrema. We'll discuss ways of mitigating this issue using computer vision to add spatial context information to restrict the domain of optimization. These techniques not only speed up the training, but also improve the overall performance of the networks. We'll demonstrate results on real-world classification and segmentation problems.","Daniel Russakoff, Co-Founder and Principal Scientist, Voxeleron",Healthcare & Life Sciences
NVIDIA GTC 2020,Insight-Driven Machine Learning Design with Human Expert Collaborations [S21636],"The fundamental breakthroughs in machine learning, and the rapid advancements of the underlying deep neural network models have enabled the potential use of these systems in specialized, high stakes domains such as healthcare. However, despite this remarkable progress, the design of machine learning systems remains laborious, computationally expensive and opaque, sometimes resulting in catastrophic failures and significantly hindering their ability to work with human experts, who play critical roles in these settings. In this talk, I overview steps towards a more informed, intuitive design of machine learning systems, and methods to facilitate collaboration with human experts. I develop tools that enable the quantitative analysis of the complex hidden layers of deep neural networks, which in turn provides both fundamental insights and informs algorithms for efficiently training these systems. I demonstrate how these trained systems can be adapted to work effectively with human experts, resulting in better outcomes than either entity alone.","Maithra Raghu, Research Scientist, Google Brain",Healthcare & Life Sciences
NVIDIA GTC 2020,Machine Learning Cell Phenotypes with Immuno-Fluorescent Cancer Tissue [P22105],"Multiplexed immuno-fluorescent tissue imaging enables precise spatial assessment of protein expression in medical resection specimens. However, tissue sections are stained with a mixture of antibodies, DNA, and RNA markers. Detecting weak or broken edges due to fluorescent membrane-staining artifacts between touching or overlapping cells is a long-studied problem, and is an active research topic in biomedical image analysis. Sometimes, even humans can't visually detect these kinds of edges. We've built a GPU client-server and developed a hybrid system combining the stochastic random-reaction-seed (RRS) method and deep neural learning U-net to identify cell membranes accurately and automatically. Furthermore, we've designed a high-performance AI pipeline in quantifying spatial distribution of cell phenotypes from tissue images with various complexities.","Alvason Zhenhua Li, Postdoctoral Research Fellow, Fred Hutchinson Cancer Research Center",Healthcare & Life Sciences
