title,description,company,industry
Automated and Intelligent Cloud Bursting Tool using Deep Neural Networks [P21917],"We'll highlight the need to look at cloud as a suitable option for risk computation in banks and financial institutions, and provide a framework for intelligent, automated, and cost-effective models using hybrid cloud for risk analytics computation. The two variations seen in financial risk computation —periodic but intensive risk computation, such as quarterly stress testing and daily computation that peaks due to ad hoc surge requests, such as what-if analysis — are both very suitable for hybrid cloud-based implementation, given the cost advantages.","Rajesh Kulkarni, Consultant, TATA Consultancy Services",Finance
AWDF: An Adaptive Weighted Deep Fusion Architecture for Multi-Modality Learning [P21985],"Deep model fusion is getting lots of attention in dealing with multi-modality learning problems. We propose an Adaptive Weighted Deep Fusion scheme (AWDF) to capture potential relationships among various input sources. It integrates the feature-level and decision-level fusion in one framework. To address the limitations of existing fusing models with fixed weights, we also propose a new scheme named Cross Decision Weights Method (CDWM). It can dynamically learn the weight for each input branch during the fusion process instead of utilizing predefined weights. To evaluate the performance of AWDF, we conducted experiments on three different real-world datasets: Wild Business Terms, Iceberg Detection, and CareerCon. Our experiments demonstrate that AWDF outperforms other fusion systems by a large margin. (This work has been accepted by IEEE Big Data 2019 Special Session on Intelligent Data Mining).","Qinghan Xue, Applied Data Scientist, IBM",Cloud Services
BasketballGAN : Generating Basketball Play Simulation Through Sketching [P21206],"Given an offensive set play sketch, our method simulates potential scenarios that can occur in the game. The simulation provides coaches and players with insights on how a given set play can be executed. To do this, we train a conditional adversarial network on NBA movement data to imitate the behaviors of how players move around the court. Code and user study are available on GitHub.","Cheng-Kuang Lee, Senior Solution Architect, NVIDIA",Media & Entertainment
Benanza: Automatic μBenchmark Generation to Compute ”Lower-bound” Latency and Inform Optimizations of Deep Learning Models on GPUs [P21858],"Current profiling tools lack the highly desired abilities to characterize ideal performance, identify sources of inefficiency, and quantify the benefits of potential optimizations. Such deficiencies have led to slow characterization/optimization cycles that can't keep up with the fast pace at which new DL models are introduced. We propose Benanza, a sustainable and extensible benchmarking and analysis design that speeds up the characterization/optimization cycle of DL models on GPUs.","Abdul Dakkak, Ph.D. Student, University of Illinois Urbana-Champaign",Higher Education / Research
Beyond-Line-of-Sight (BLOS) Perception System for Autonomous Vehicles [P21842],"Recently, autonomous vehicle perception systems show great performance based on deep-learning technology. Cameras and lidar are commonly used for autonomous driving. However, onboard sensors naturally have limited line-of-sight. Our work introduces a BLOS (beyond-line-of-sight) perception system that mutually complements communicated perception with V2X technology and local perception with onboard sensors. The proposed system is integrated into a full-scale vehicle, and we validated the performance and potential by experiments in the real world.","Chanyoung Chung, Researcher, KAIST (Korea Advanced Institute of Science and Technology)",Automotive / Transportation
Bike-Share Demand Prediction from Partial Future data Using Conditional Variational AutoEncoders [P21739],"Recently, bike-sharing services are working worldwide. One important aspect of bike-share management is to periodically rebalance the positions of the available bikes. Because the bike demand varies by and over time, the number of bikes at each bike-port tends to become unbalanced. To efficiently rebalance a bike-share system, it is essential to predict the number of bikes in each bike-port. In this poster, we propose a method to predict the bike demand at each bike-port every hour, up to 24 hours ahead. This method is based on Variational AutoEncoders and Sequence-to-Sequence Neural Networks. We called this method “Conditional Variational AutoEncoders considering Partial Future data”. In the experiment, our proposal method showed higher prediction accuracy than the other methods.","Mimura Tomohiro, Software Engineer, NTT DOCOMO, INC.",Automotive / Transportation
CapsNet-Lite: A Lightweight and High Performance CapsNet Architecture [P21854],"The capsule network (CapsNet) includes a new type of layer composed by ""capsules"". A capsule is a vector that stores in each position the amount of a certain object feature that's present in the image. Then, those capsules are combined to output the label of the object. To learn how to combine the capsules, this network also needs a routing algorithm. This type of network achieves very high accuracy in classification problems. We propose a modified CapsNet architecture called CapsNet-Lite that outperforms the original proposal in accuracy, with a much faster training procedure.","Francisco José García, Ph.D. Student, Universidad Rey Juan Carlos",Higher Education / Research
Capsule Networks for 3D Pose Estimation in Computer Graphics [P21924],"Pose estimation is an important task for novel engineering applications, such as virtual and augmented reality (VR/AR), pose-based video games, object reconstruction, target tracking, driving assistance, and recent sports analytics. Commonly, an efficient pose estimation system depends on the pose visualization given by a 3D configuration of location, orientation, and scaling parameters of the target. In this work, we implement Capsule Networks to solve 3D pose estimation in computer graphics of rigid objects using a multi-GPU architecture.","Kenia Picos, Professor, CETYS Universidad",Higher Education / Research
cGAN for Automatic Site Selection of Cultural Venues [P22404],"Cultural venues, such as libraries, theaters, cinemas, and galleries, contribute to a city’s tourism and economy and enrich the cultural life of the local residents. In this work, we propose a novel approach to automatic site selection of cultural venues in an urban area, which requires less expertise in urban planning. The two-stage approach consists of a learning stage for predicting zones as a prior constraint, and an optimization stage for determining the number of cultural venues and their exact locations according to multiple criteria. Given an input set of urban data, our approach generates an optimal configuration of two-dimensional locations for cultural venues that complies with land-use policies and provides easy access for the public. We implemented the approach using reliable methods of deep learning and stochastic optimization, and the results demonstrate the approach's effectiveness by a comparison to real-world counterparts.","Tomasz Bednarz, Director of Visualisation, CSIRO and UNSW",Other
CheetahDB: A System for High-Throughput Database Processing on GPUs [P22073],"GPU database is an active topic in academic research and industrial practice. However, existing systems have not shown significant performance advantages over CPU-based in-memory database management systems (DBMS). Two main factors contributed to such difficulties: First, the CUDA programming model, by focusing on HPC-type workloads, requires non-trivial basic research to address the many technical challenges in developing a DBMS system software; and second, I/O bottleneck between host and GPU offsets the performance gain of onboard query processing. CheetahDB is a high-performance in-memory DBMS generated from NSF-supported research at the database group in the University of South Florida and commercialized by Cheetah Data Systems, Inc. CheetahDB addresses the above challenges via a complete rethinking of the software architecture of a DBMS under today’s multi-core hardware environment.","Chengcheng Mou, Student, University of South Florida",Higher Education / Research
Computer Vision in Agriculture: Racing with Pests and Diseases [P22001],"Modern technologies of GPU computing and machine learning allow us to create an autonomous system of greenhouse plant condition control. We combined multiple sensor systems with a photo/video surveillance system, which allows us to create a comprehensive control system helpful for early detection of pests and diseases. We strive to create a stable and reliable solution for AI-based early plant disease detection, disease classification, pest detection, and plant development monitoring. We present our working solutions for vertical farming and a prototype of a more general system.","Ivan Molodtsov, Head of Machine Learning, Fermata",Healthcare & Life Sciences
Container-Based Artificial Intelligence Applications Deployment Platform for GPU High Performance Computing Clusters [P21902],"A container-based AI applications deployment platform was proposed and implemented in our center to solve root privileges and network issues in HPC clusters. A virtual machine is used to simulate the targeted HPC cluster, which has the same or similar runtime environment including compilers, shared libraries, and GPU drivers based on a GPU card attached by PCI pass-through way. Users can have root privileges of virtual machines to set up containers. Further, a user can create containers and deploy AI applications by network tools, because each user has an exclusive virtual machine running on an independent server that connects to internet. The deploy platform and the HPC clusters are connected by a 10Gb/s, or even 100Gb/s network so that users can transfer the container images quickly and easily.","Rongqiang Cao, Associate Professor, Computer Network Information Center, Chinese Academy of Sciences",Cloud Services
Data-Driven Approach of Coronary Vessel Reconstruction Using X-ray Angiography [P21799],"Coronary artery disease is typically diagnosed using X-ray angiography. The percent stenosis, or narrowing of the blood vessel, is estimated via visual inspection of 2D angiography images; however, image artifacts and non-ideal projection angles can lead to miscalculation of disease severity. To address this problem, we propose a data-driven method to reconstruct the 3D geometry of the coronary vessels. A convolutional neural network was trained to segment vessels from angiography images. The segmented binary images were subsequently used as input images for several 3D reconstruction algorithms. The reconstructed 3D geometry can be used as input data for computational fluid dynamics analysis to characterize the hemodynamics of the diseased vessel and thus further improve diagnostic accuracy.","Kritika Iyer, Ph.D. Candidate, University of Michigan",Healthcare & Life Sciences
Data-Efficient Weakly Supervised Histology Classification Using Contrastive Predictive Coding [P22025],"Neural network classification models can be trained on weakly annotated medical imaging data using multiple instance learning (MIL). However, due to weak supervisory signals, direct application of MIL suffers from overfitting when faced with limited labeled data and the network is unable to learn rich feature representations. To overcome such limitations, we propose a two-stage semi-supervised approach that combines data-efficient self-supervised feature learning via contrastive predictive coding (CPC) and attention-based MIL. Across five random splits, we report state-of-the-art performance with a mean validation accuracy of 95% and an area under the ROC curve of 0.968 on a breast cancer classification dataset. We evaluate the quality of features learned via CPC relative to simple transfer learning and show that strong classification performance using CPC features can be efficiently leveraged under the MIL framework using limited labels and with the feature encoder frozen.","Ming Yang Lu, Research Intern , Computational Pathology, Brigham and Women's Hospital, Harvard Medical School",Healthcare & Life Sciences
Data Mining Pipeline for Predictive Synthesis of Advanced Materials [P22007],"Materials discovery is significantly facilitated and accelerated by high-throughput ab-initio computations. Being able to rapidly design advanced compounds has displaced the materials-innovation bottleneck to developing synthesis routes for the desired material. As there isn't a fundamental theory for materials synthesis, one might attempt a data-driven approach for predicting inorganic materials synthesis, but this is impeded by the lack of a comprehensive database of synthesis parameters. We've generated a dataset of “codified recipes” for solid-state synthesis automatically extracted from scientific publications. The dataset consists of about 20,000 synthesis entries retrieved from over 50,000 solid-state synthesis paragraphs by using text mining and natural language processing approaches. The dataset is publicly available and can be used for data mining of various aspects of inorganic materials synthesis.","Olga Kononova, Postdoctoral Scholar, University of California, Berkeley",Higher Education / Research
Decoding Texture Information from Rat Somatosensory Cortical Neurons Using CNN [P21855],"Neurons in the neocortex often exhibit feature selectivity against external stimuli. Simple stimuli can be decoded from activity of a single neuron; however, it has been poorly understood whether more complicated features can be decoded from the neuronal activity. To address this question, we recorded local field potentials (LFPs), which reflect the activity of thousands of neurons, of rats given complex sensory stimuli and took advantage of a convolutional neural network (CNN) for decoding. To this end, we developed a novel electrode array that enables wide-range recording from the superficial layers of the cortex. We recorded LFPs from the primary somatosensory cortex (S1) of a rat exploring on either rough or smooth floor. Our CNN model yielded 78% accuracy on average for decoding the surface texture. This suggests that somatosensory LFPs contain enough information to decode a surface texture.","Kotaro Yamashiro, Ph.D. Student, The University Tokyo, Graduate School of Pharmaceutical Sciences",Higher Education / Research
Deep Autoencoder-Based Statistical Arbitrage During a Bearish Market [P22088],"During a market that is headed generally downward, an investor can use long and short positions at key points in time for profit. We introduce a deep autoencoder as a type of neural network to observe the return patterns for a basket of Dow 30 stocks, using a GPU to accelerate this unsupervised learning process. Depending upon the strength of the GPU, we can observe more rapid training, which helps our back-testing and hyper-parameter search process and has an impact on profitability.","Mark Bennett, Senior Solutions Architect, NVIDIA",Finance
"Deep Learning-Aided Label-Free, Real-Time and Time-Lapse “Cell Visualization” Technology that Enables Live/Dead Cell Discrimination and Counting [P21952]","""Cell visualization"" is a new technology that can predict cell properties, such as cell life and death, from bright-field cell images. It's necessary to build a deep-learning model in which the relationship between a teacher cell image, such as fluorescence labeling indicating cell properties, and the corresponding bright-field cell image is finely learned. Inputting unknown bright-field cell images to the constructed learning model generates a pseudo-fluorescent labeling image showing the characteristics of the cells, enabling ""visualization of cells."" The present technology may replace many cell assays in drug discovery by solving the invasiveness of fluorescence-based cell assays. This technology also realizes real-time monitoring of cell quality. This innovative cell digitization technology is expected to become essential in the fields of drug discovery and regenerative medicine.","Tamio Mizukami, Professor, Nagahama Institute of Bio-Science and Technology",Healthcare & Life Sciences
Deep Learning-Based Anti-Drone System [P21900],This poster is about research on detecting and tracking drones by applying deep learning technology to capture drones that are illegally operated.,"Hanseob Lee, Ph.D. Candidate, KAIST",Aerospace / Defense / Government
Deep-Learning Model for Finding New Superconductors [P21328],"We report the first deep-learning model for finding new superconductors. We represented the periodic table in such a way that deep learning can learn it. Although we used only the chemical composition of materials as information, we obtained an R2 value of 0.92 for predicting Tc for materials in a database of superconductors. We obtained three remarkable results. The deep-learning method can predict superconductivity for a material with a precision of 62\%, which shows the usefulness of the model; it found the recently discovered superconductor CaBi2, which is not in the superconductor database; and it found Fe-based high-temperature superconductors (discovered in 2008) from the training data before 2008. These results open the way for the discovery of new high-temperature superconductor families.","Tomohiko Konno, Researcher, National Institute of Information and Communications Technology",Aerospace / Defense / Government
D-GEN: A Deep Learning Data Generation Framework for Artificial Intelligence [P22097],"Synthetic data is an increasingly popular and powerful tool for training deep-learning models, especially in computer vision tasks as well as other areas. In this work, we present a synthetic training data-generation framework for artificial intelligence. This work includes a variety of technology fields: GPU-based big data computing, game engine-based image generation, probabilistic generative models (GANs, VAE), domain randomization, and automatic data augmentation. GPU-based 3D rendering and deep neural nets training accelerate the wide use of generated massive synthetic dataset for artificial intelligence. Synthetic data works well on a variety of military tasks and domains. We believe that synthetic data is essential for deep learning-based machine intelligence in data-scarce fields.","Se-Yoon Oh, Big Data Team Leader, Agency for Defense Development",All Industries
Distributed Deep Learning for Automatic Disease Detection Systems [P22078],"Deep neural networks and other deep-learning approaches are providing diagnostic capabilities on a par with medical specialists. If deployed in the field, these DL applications and devices can help to detect health conditions early and develop preventive approaches. However, deploying such systems requires large compute infrastructure. To address the infrastructure issues, I developed a distributed cost-effective approach using edge devices and a cloud-based central hub for better predictions. To test its effectiveness, I applied it to diagnosing eye conditions using fundus images.","Ananya Gangavarapu, Student, Princeton International School of Mathematics and Science",Healthcare & Life Sciences
Dramatic Acceleration of Quantum Transport Simulations: Solving Non-Equilibrium Green’s Function with GPU Devices [P21787],"The poster presents in-depth discussion on technical details and strategies for GPU-driven performance enhancement in solving the Non-Equilibrium Green's Function (NEGF), which is critically used to simulate quantum transport behaviors of electronic devices in a nanoscale regime. Although here we focus on NEGF as a main target of performance enhancement, the contents (particularly the strategies of performance improvement with GPU computing) presented in this poster can be still useful for ANY numerical problems that involve the computation of an inverse of block-tridiagonal (dense/sparse, real/complex) matrices.","Yosang Jeong, Researcher, Korea Institute of Science and Technology Information",National Labs / Research Computing Centers
Drones as a Tool for Development and Safety Validation of Automated Driving Functions [P21913],"Automated driving heavily relies on data-driven methods. Large datasets of real-world measurement data, in the form of road-user trajectories, are crucial for several tasks, such as road-user prediction models or scenario-based safety validation. Using a drone has the major advantage of recording naturalistic behavior. Due to the ideal viewing angle, an entire scenario can be measured with significantly less occlusion than with sensors at ground level. Both the class and the trajectory of each road user can be extracted from the video recordings with high precision using state-of-the-art deep neural networks. Therefore, we have created a large-scale urban intersection dataset with naturalistic road-user behavior using camera-equipped drones. The resulting dataset contains road users including vehicles, bicyclists, and pedestrians at intersections in Germany, and is called inD. The dataset is available online for non-commercial research at: http://www.inD-dataset.com.","Julian Bock, Manager Artificial Intelligence, fka GmbH",Automotive / Transportation
